[
  {
    "ambiguity_status": "RESOLVED",
    "confidence": 0.084,
    "constraint_sources": [
      "314_ball_observations",
      "vfr_timestamps",
      "accepted_static_anchor_v4",
      "total_anchor_uncertainty",
      "soft_l1",
      "bounce_z0"
    ],
    "contact_event_id": null,
    "coordinate_unit": "metres",
    "event_context": "v32_accepted_static_anchors",
    "frame_id": 433,
    "hypothesis_id": "flight_08_h02",
    "observed_or_interpolated": "observed",
    "observed_pixel_x": 2246.142,
    "observed_pixel_y": 831.287,
    "player_identity": "unknown",
    "reprojected_pixel_x": 2292.062,
    "reprojected_pixel_y": 860.681,
    "reprojection_error_px": 54.522,
    "segment_id": "flight_08",
    "timestamp_seconds": 8.621667,
    "uncertainty_x_m": 0.75,
    "uncertainty_y_m": 0.75,
    "uncertainty_z_m": 0.5,
    "warnings": [
      "HUMAN_STAGE5B_V32_GATE_REQUIRED"
    ],
    "x_m": 5.286,
    "y_m": -12.391,
    "z_m": 2.254
  },
  {
    "ambiguity_status": "RESOLVED",
    "confidence": 0.113,
    "constraint_sources": [
      "314_ball_observations",
      "vfr_timestamps",
      "accepted_static_anchor_v4",
      "total_anchor_uncertainty",
      "soft_l1",
      "bounce_z0"
    ],
    "contact_event_id": null,
    "coordinate_unit": "metres",
    "event_context": "v32_accepted_static_anchors",
    "frame_id": 436,
    "hypothesis_id": "flight_09_h01",
    "observed_or_interpolated": "observed",
    "observed_pixel_x": 2226.834,
    "observed_pixel_y": 807.688,
    "player_identity": "unknown",
    "reprojected_pixel_x": 2198.021,
    "reprojected_pixel_y": 769.896,
    "reprojection_error_px": 47.523,
    "segment_id": "flight_09",
    "timestamp_seconds": 8.671667,
    "uncertainty_x_m": 0.75,
    "uncertainty_y_m": 0.75,
    "uncertainty_z_m": 0.5,
    "warnings": [
      "HUMAN_STAGE5B_V32_GATE_REQUIRED"
    ],
    "x_m": 4.641,
    "y_m": -12.691,
    "z_m": 2.898
  },
  {
    "ambiguity_status": "RESOLVED",
    "confidence": 0.012,
    "constraint_sources": [
      "314_ball_observations",
      "vfr_timestamps",
      "accepted_static_anchor_v4",
      "total_anchor_uncertainty",
      "soft_l1",
      "bounce_z0"
    ],
    "contact_event_id": null,
    "coordinate_unit": "metres",
    "event_context": "v32_accepted_static_anchors",
    "frame_id": 262,
    "hypothesis_id": "flight_04_h02",
    "observed_or_interpolated": "interpolated",
    "observed_pixel_x": 1544.625,
    "observed_pixel_y": 953.927,
    "player_identity": "unknown",
    "reprojected_pixel_x": 1555.819,
    "reprojected_pixel_y": 1000.024,
    "reprojection_error_px": 47.436,
    "segment_id": "flight_04",
    "timestamp_seconds": 5.188333,
    "uncertainty_x_m": 0.75,
    "uncertainty_y_m": 0.75,
    "uncertainty_z_m": 0.5,
    "warnings": [
      "HUMAN_STAGE5B_V32_GATE_REQUIRED"
    ],
    "x_m": 1.231,
    "y_m": -8.298,
    "z_m": 0.0
  },
  {
    "ambiguity_status": "RESOLVED",
    "confidence": 0.082,
    "constraint_sources": [
      "314_ball_observations",
      "vfr_timestamps",
      "accepted_static_anchor_v4",
      "total_anchor_uncertainty",
      "soft_l1",
      "bounce_z0"
    ],
    "contact_event_id": null,
    "coordinate_unit": "metres",
    "event_context": "v32_accepted_static_anchors",
    "frame_id": 351,
    "hypothesis_id": "flight_07_h01",
    "observed_or_interpolated": "observed",
    "observed_pixel_x": 870.192,
    "observed_pixel_y": 186.084,
    "player_identity": "unknown",
    "reprojected_pixel_x": 911.681,
    "reprojected_pixel_y": 163.81,
    "reprojection_error_px": 47.09,
    "segment_id": "flight_07",
    "timestamp_seconds": 6.971667,
    "uncertainty_x_m": 0.75,
    "uncertainty_y_m": 0.75,
    "uncertainty_z_m": 0.5,
    "warnings": [
      "HUMAN_STAGE5B_V32_GATE_REQUIRED"
    ],
    "x_m": -4.564,
    "y_m": 11.726,
    "z_m": 2.506
  },
  {
    "ambiguity_status": "RESOLVED",
    "confidence": 0.13,
    "constraint_sources": [
      "314_ball_observations",
      "vfr_timestamps",
      "accepted_static_anchor_v4",
      "total_anchor_uncertainty",
      "soft_l1",
      "bounce_z0"
    ],
    "contact_event_id": null,
    "coordinate_unit": "metres",
    "event_context": "v32_accepted_static_anchors",
    "frame_id": 160,
    "hypothesis_id": "flight_02_h02",
    "observed_or_interpolated": "observed",
    "observed_pixel_x": 1258.226,
    "observed_pixel_y": 555.614,
    "player_identity": "unknown",
    "reprojected_pixel_x": 1258.923,
    "reprojected_pixel_y": 510.187,
    "reprojection_error_px": 45.433,
    "segment_id": "flight_02",
    "timestamp_seconds": 3.171667,
    "uncertainty_x_m": 0.75,
    "uncertainty_y_m": 0.75,
    "uncertainty_z_m": 0.5,
    "warnings": [
      "HUMAN_STAGE5B_V32_GATE_REQUIRED"
    ],
    "x_m": -1.025,
    "y_m": 5.886,
    "z_m": 0.234
  },
  {
    "ambiguity_status": "RESOLVED",
    "confidence": 0.094,
    "constraint_sources": [
      "314_ball_observations",
      "vfr_timestamps",
      "accepted_static_anchor_v4",
      "total_anchor_uncertainty",
      "soft_l1",
      "bounce_z0"
    ],
    "contact_event_id": null,
    "coordinate_unit": "metres",
    "event_context": "v32_accepted_static_anchors",
    "frame_id": 261,
    "hypothesis_id": "flight_03_h00",
    "observed_or_interpolated": "observed",
    "observed_pixel_x": 1537.474,
    "observed_pixel_y": 936.943,
    "player_identity": "unknown",
    "reprojected_pixel_x": 1550.936,
    "reprojected_pixel_y": 979.615,
    "reprojection_error_px": 44.745,
    "segment_id": "flight_03",
    "timestamp_seconds": 5.171667,
    "uncertainty_x_m": 0.75,
    "uncertainty_y_m": 0.75,
    "uncertainty_z_m": 0.5,
    "warnings": [
      "HUMAN_STAGE5B_V32_GATE_REQUIRED"
    ],
    "x_m": 1.199,
    "y_m": -8.207,
    "z_m": 0.119
  },
  {
    "ambiguity_status": "RESOLVED",
    "confidence": 0.164,
    "constraint_sources": [
      "314_ball_observations",
      "vfr_timestamps",
      "accepted_static_anchor_v4",
      "total_anchor_uncertainty",
      "soft_l1",
      "bounce_z0"
    ],
    "contact_event_id": null,
    "coordinate_unit": "metres",
    "event_context": "v32_accepted_static_anchors",
    "frame_id": 292,
    "hypothesis_id": "flight_05_h02",
    "observed_or_interpolated": "observed",
    "observed_pixel_x": 1530.68,
    "observed_pixel_y": 776.581,
    "player_identity": "unknown",
    "reprojected_pixel_x": 1509.579,
    "reprojected_pixel_y": 744.47,
    "reprojection_error_px": 38.424,
    "segment_id": "flight_05",
    "timestamp_seconds": 5.788333,
    "uncertainty_x_m": 0.75,
    "uncertainty_y_m": 0.75,
    "uncertainty_z_m": 0.5,
    "warnings": [
      "HUMAN_STAGE5B_V32_GATE_REQUIRED"
    ],
    "x_m": 0.674,
    "y_m": -15.632,
    "z_m": 3.851
  },
  {
    "ambiguity_status": "RESOLVED",
    "confidence": 0.016,
    "constraint_sources": [
      "314_ball_observations",
      "vfr_timestamps",
      "accepted_static_anchor_v4",
      "total_anchor_uncertainty",
      "soft_l1",
      "bounce_z0"
    ],
    "contact_event_id": null,
    "coordinate_unit": "metres",
    "event_context": "v32_accepted_static_anchors",
    "frame_id": 199,
    "hypothesis_id": "flight_02_h02",
    "observed_or_interpolated": "interpolated",
    "observed_pixel_x": 1113.417,
    "observed_pixel_y": 161.949,
    "player_identity": "unknown",
    "reprojected_pixel_x": 1118.437,
    "reprojected_pixel_y": 128.002,
    "reprojection_error_px": 34.316,
    "segment_id": "flight_02",
    "timestamp_seconds": 3.938333,
    "uncertainty_x_m": 0.75,
    "uncertainty_y_m": 0.75,
    "uncertainty_z_m": 0.5,
    "warnings": [
      "HUMAN_STAGE5B_V32_GATE_REQUIRED"
    ],
    "x_m": -2.713,
    "y_m": 16.292,
    "z_m": 2.192
  },
  {
    "ambiguity_status": "RESOLVED",
    "confidence": 0.128,
    "constraint_sources": [
      "314_ball_observations",
      "vfr_timestamps",
      "accepted_static_anchor_v4",
      "total_anchor_uncertainty",
      "soft_l1",
      "bounce_z0"
    ],
    "contact_event_id": null,
    "coordinate_unit": "metres",
    "event_context": "v32_accepted_static_anchors",
    "frame_id": 198,
    "hypothesis_id": "flight_02_h02",
    "observed_or_interpolated": "observed",
    "observed_pixel_x": 1115.103,
    "observed_pixel_y": 161.949,
    "player_identity": "unknown",
    "reprojected_pixel_x": 1120.888,
    "reprojected_pixel_y": 129.389,
    "reprojection_error_px": 33.07,
    "segment_id": "flight_02",
    "timestamp_seconds": 3.921667,
    "uncertainty_x_m": 0.75,
    "uncertainty_y_m": 0.75,
    "uncertainty_z_m": 0.5,
    "warnings": [
      "HUMAN_STAGE5B_V32_GATE_REQUIRED"
    ],
    "x_m": -2.676,
    "y_m": 16.066,
    "z_m": 2.211
  },
  {
    "ambiguity_status": "RESOLVED",
    "confidence": 0.222,
    "constraint_sources": [
      "314_ball_observations",
      "vfr_timestamps",
      "accepted_static_anchor_v4",
      "total_anchor_uncertainty",
      "soft_l1",
      "bounce_z0"
    ],
    "contact_event_id": null,
    "coordinate_unit": "metres",
    "event_context": "v32_accepted_static_anchors",
    "frame_id": 444,
    "hypothesis_id": "flight_09_h01",
    "observed_or_interpolated": "observed",
    "observed_pixel_x": 1981.196,
    "observed_pixel_y": 559.905,
    "player_identity": "unknown",
    "reprojected_pixel_x": 2001.397,
    "reprojected_pixel_y": 582.396,
    "reprojection_error_px": 30.231,
    "segment_id": "flight_09",
    "timestamp_seconds": 8.838333,
    "uncertainty_x_m": 0.75,
    "uncertainty_y_m": 0.75,
    "uncertainty_z_m": 0.5,
    "warnings": [
      "HUMAN_STAGE5B_V32_GATE_REQUIRED"
    ],
    "x_m": 4.356,
    "y_m": -5.712,
    "z_m": 2.332
  },
  {
    "ambiguity_status": "RESOLVED",
    "confidence": 0.217,
    "constraint_sources": [
      "314_ball_observations",
      "vfr_timestamps",
      "accepted_static_anchor_v4",
      "total_anchor_uncertainty",
      "soft_l1",
      "bounce_z0"
    ],
    "contact_event_id": null,
    "coordinate_unit": "metres",